{
  "$schema": "../../../schemas/enemy-archetype.schema.json",
  "id": "gate-sentry",
  "name": "Gate Sentry",
  "sprite": "sprite:guard-spearman",
  "palette": "palette:sentry",
  "hp": 55,
  "speed": 38,
  "hitbox": {
    "w": 12,
    "h": 12
  },
  "behavior": "guard",
  "guard": {
    "aggroRange": 110,
    "deaggroRange": 140,
    "leashRange": 96
  },
  "family": "gate-sentry"
}
