{
  "$schema": "../../../schemas/enemy-archetype.schema.json",
  "id": "run-boss",
  "name": "Run Boss",
  "sprite": "sprite:bandit-swordsman",
  "palette": "palette:raider",
  "hp": 66,
  "speed": 30,
  "hitbox": {
    "w": 13,
    "h": 13
  },
  "behavior": "guard",
  "guard": {
    "aggroRange": 88,
    "deaggroRange": 128,
    "leashRange": 150,
    "stance": {
      "guard": 1.0,
      "open": 1.3,
      "damageMultiplier": 0.45,
      "moveFactor": 0.5
    }
  },
  "miniboss": true
}
