{
  "$schema": "../../../schemas/enemy-archetype.schema.json",
  "id": "dragon-guardian",
  "name": "Route Dragon",
  "sprite": "sprite:high-dragon",
  "palette": "palette:boss",
  "family": "dragon",
  "hp": 60,
  "speed": 44,
  "hitbox": {
    "w": 18,
    "h": 18
  },
  "behavior": "boss",
  "boss": {
    "aggroRange": 140,
    "cooldown": 1.6,
    "spreadAngles": [-0.2, 0.2],
    "projectile": {
      "type": "shadowbolt",
      "speed": 80,
      "life": 2.5
    },
    "sfx": "magic",
    "phases": {
      "roar": 0.9,
      "volley": 0.9,
      "lull": 1.4,
      "armorMultiplier": 0.5
    }
  }
}
