{
  "$schema": "../../../schemas/enemy-archetype.schema.json",
  "id": "plunder-boss",
  "name": "Plunder Boss",
  "sprite": "sprite:boss-plunder-boss",
  "palette": "palette:base",
  "hp": 56,
  "speed": 28,
  "hitbox": {
    "w": 14,
    "h": 14
  },
  "behavior": "guard",
  "guard": {
    "aggroRange": 92,
    "deaggroRange": 136,
    "leashRange": 156,
    "stance": {
      "guard": 1.1,
      "open": 1.3,
      "damageMultiplier": 0.4,
      "moveFactor": 0.45
    }
  },
  "miniboss": true
}
