{
  "$schema": "../../../schemas/enemy-archetype.schema.json",
  "id": "pen-warden",
  "name": "Pen Warden",
  "sprite": "sprite:boss-pen-warden",
  "palette": "palette:base",
  "hp": 54,
  "speed": 34,
  "hitbox": {
    "w": 14,
    "h": 14
  },
  "behavior": "guard",
  "guard": {
    "aggroRange": 96,
    "deaggroRange": 140,
    "leashRange": 158,
    "stance": {
      "guard": 1.0,
      "open": 1.35,
      "damageMultiplier": 0.42,
      "moveFactor": 0.5
    }
  },
  "miniboss": true
}
