{
  "$schema": "../../../schemas/enemy-archetype.schema.json",
  "id": "shadow-warlord",
  "name": "Shadow Warlord",
  "sprite": "sprite:caped-warrior",
  "palette": "palette:boss",
  "hp": 160,
  "speed": 52,
  "hitbox": {
    "w": 18,
    "h": 18
  },
  "behavior": "boss",
  "boss": {
    "aggroRange": 160,
    "cooldown": 1.4,
    "spreadAngles": [-0.25, 0, 0.25],
    "projectile": {
      "type": "shadowbolt",
      "speed": 90,
      "life": 3
    },
    "sfx": "magic"
  }
}
